<!ELEMENT catalog (product+)>
<!ELEMENT product (name, price, description)>
<!ATTLIST product id ID #REQUIRED>
<!ATTLIST product category (electronics|fashion|home) #REQUIRED>
<!ELEMENT name (#PCDATA)>
<!ELEMENT price (#PCDATA)>
<!ELEMENT description (#PCDATA)>
